,OCCUPATION,JOB SUMMARY,ENTRY-LEVEL EDUCATION,2019 MEDIAN PAY
1,Bakers,"Bakers mix ingredients according to recipes in order to make breads, pastries, and other baked goods.",No formal educational credential,"$27,700"
2,Butchers,"Butchers cut, trim, and package meat for retail sale.",No formal educational credential,"$32,500"
3,Dental and Ophthalmic Laboratory Technicians and Medical Appliance Technicians,"Dental and ophthalmic laboratory technicians and medical appliance technicians construct, fit, or repair medical appliances and devices.",High school diploma or equivalent,"$37,370"
4,Food and Tobacco Processing Workers,"Food and tobacco processing workers operate equipment that mixes, cooks, or processes ingredients used in the manufacture of food and tobacco products.",See How to Become One,"$30,200"
5,Jewelers and Precious Stone and Metal Workers,"Jewelers and precious stone and metal workers design, construct, adjust, repair, appraise and sell jewelry.",High school diploma or equivalent,"$40,870"
6,Machinists and Tool and Die Makers,"Machinists and tool and die makers set up and operate machine tools to produce precision metal parts, instruments, and tools.",See How to Become One,"$45,750"
7,Metal and Plastic Machine Workers,"Metal and plastic machine workers set up and operate machines that cut, shape, and form metal and plastic materials or pieces.",See How to Become One,"$36,990"
8,Painting and Coating Workers,"Painting and coating workers paint and coat a wide range of products, often with the use of machines.",See How to Become One,"$37,770"
9,"Power Plant Operators, Distributors, and Dispatchers","Power plant operators, distributors, and dispatchers control the systems that generate and distribute electric power.",High school diploma or equivalent,"$85,950"
10,Quality Control Inspectors,Quality control inspectors examine products and materials for defects or deviations from specifications.,High school diploma or equivalent,"$39,140"
11,Stationary Engineers and Boiler Operators,"Stationary engineers and boiler operators control stationary engines, boilers, or other mechanical equipment.",High school diploma or equivalent,"$62,150"
12,Water and Wastewater Treatment Plant and System Operators,Water and wastewater treatment plant and system operators manage a system of machines to transfer or treat water or wastewater.,High school diploma or equivalent,"$47,760"
13,"Welders, Cutters, Solderers, and Brazers","Welders, cutters, solderers, and brazers use hand-held or remotely controlled equipment to join, repair, or cut metal parts and products.",High school diploma or equivalent,"$42,490"
14,Woodworkers,"Woodworkers manufacture a variety of products such as cabinets and furniture, using wood, veneers, and laminates.",High school diploma or equivalent,"$32,690"
0,Correctional Officers and Bailiffs,Correctional officers oversee those who have been arrested and are awaiting trial or who have been sentenced to serve time in jail or prison. Bailiffs are law enforcement officers who maintain safety and order in courtrooms.,High school diploma or equivalent,"$45,300"
1,Firefighters,"Firefighters control and put out fires and respond to emergencies where life, property, or the environment is at risk.",Postsecondary nondegree award,"$50,850"
2,Fire Inspectors,"Fire inspectors examine buildings in order to detect fire hazards and ensure that federal, state, and local fire codes are met.",See How to Become One,"$60,230"
3,Police and Detectives,Police officers protect lives and property. Detectives and criminal investigators gather facts and collect evidence of possible crimes.,See How to Become One,"$65,170"
4,Private Detectives and Investigators,"Private detectives and investigators search for information about legal, financial, and personal matters.",High school diploma or equivalent,"$50,510"
5,Security Guards and Gaming Surveillance Officers,Security guards and gaming surveillance officers patrol and protect property from illegal activity.,High school diploma or equivalent,"$29,710"
0,Advertising Sales Agents,Advertising sales agents sell advertising space to businesses and individuals.,High school diploma or equivalent,"$53,310"
1,Cashiers,Cashiers process payments from customers purchasing goods and services.,No formal educational credential,"$23,650"
2,Insurance Sales Agents,Insurance sales agents contact potential customers and sell one or more types of insurance.,High school diploma or equivalent,"$50,940"
3,Models,"Models pose for artists, photographers, and other clients to help advertise products.",No formal educational credential,"$28,350"
4,Real Estate Brokers and Sales Agents,"Real estate brokers and sales agents help clients buy, sell, and rent properties.",High school diploma or equivalent,"$50,730"
5,Retail Sales Workers,Retail sales workers help customers find products they want and process customers’ payments.,No formal educational credential,"$25,440"
6,Sales Engineers,Sales engineers sell complex scientific and technological products or services to businesses.,Bachelor's degree,"$103,900"
7,"Securities, Commodities, and Financial Services Sales Agents","Securities, commodities, and financial services sales agents connect buyers and sellers in financial markets.",Bachelor's degree,"$62,270"
8,Travel Agents,"Travel agents sell transportation, lodging, and entertainment activities to individuals and groups planning trips.",High school diploma or equivalent,"$40,660"
9,Wholesale and Manufacturing Sales Representatives,"Wholesale and manufacturing sales representatives sell goods for wholesalers or manufacturers to businesses, government agencies, and other organizations.",See How to Become One,"$63,000"
0,Airline and Commercial Pilots,"Airline and commercial pilots fly and navigate airplanes, helicopters, and other aircraft.",See How to Become One,"$121,430"
1,Air Traffic Controllers,Air traffic controllers coordinate the movement of aircraft to maintain safe distances between them.,Associate's degree,"$122,990"
2,Bus Drivers,Bus drivers transport people between various places.,See How to Become One,"$33,300"
3,Delivery Truck Drivers and Driver/Sales Workers,"Delivery truck drivers and driver/sales workers pick up, transport, and drop off packages and small shipments within a local region or urban area.",High school diploma or equivalent,"$32,020"
4,Flight Attendants,Flight attendants provide routine services and respond to emergencies to ensure the safety and comfort of airline passengers.,High school diploma or equivalent,"$56,640"
5,Hand Laborers and Material Movers,"Hand laborers and material movers manually move freight, stock, or other materials.",No formal educational credential,"$28,710"
6,Heavy and Tractor-trailer Truck Drivers,Heavy and tractor-trailer truck drivers transport goods from one location to another.,Postsecondary nondegree award,"$45,260"
7,Material Moving Machine Operators,Material moving machine operators use machinery to transport various objects.,See How to Become One,"$36,770"
8,Railroad Workers,"Workers in railroad occupations ensure that passenger and freight trains safely run on time. They may drive trains, coordinate the activities of the trains, or operate signals and switches in the rail yard.",High school diploma or equivalent,"$65,020"
9,"Taxi Drivers, Ride-Hailing Drivers, and Chauffeurs","Taxi drivers, ride-hailing drivers, and chauffeurs transport people to and from the places they need to go.",No formal educational credential,"$31,340"
10,Water Transportation Workers,Water transportation workers operate and maintain vessels that take cargo and people over water.,See How to Become One,"$57,330"
